{
  "schema_version": "1.0.0",
  "documento_id": "DOC-PJE-003",
  "id_pje": "900003",
  "processo_cnj": "0000001-00.2026.4.00.0001",
  "titulo_original": "Parecer fictício com anexos",
  "tipo_original": "Documento comprobatório",
  "classe_normalizada": "DOCUMENTO_COMPOSTO",
  "subclasse_normalizada": "PARECER_FOTOS_ORCAMENTO",
  "prioridade": "A_ESSENCIAL",
  "ordem_indice": 3,
  "data_hora": "2026-01-01T10:02:00-03:00",
  "paginas": [
    {"referencia": {"pagina_pdf": 6, "pagina_documento": 1, "pagina_original": "1"}, "classificacao": "TEXTO_DIGITAL", "possui_texto_util": true, "possui_imagens": false, "possui_tabelas": false, "requer_ocr": false, "confianca": {"nivel": "ALTA"}},
    {"referencia": {"pagina_pdf": 7, "pagina_documento": 2, "pagina_original": "2"}, "classificacao": "TEXTO_E_IMAGEM", "possui_texto_util": true, "possui_imagens": true, "possui_tabelas": false, "requer_ocr": false, "confianca": {"nivel": "ALTA"}},
    {"referencia": {"pagina_pdf": 8, "pagina_documento": 3, "pagina_original": "3"}, "classificacao": "TABELA_COMPLEXA", "possui_texto_util": true, "possui_imagens": false, "possui_tabelas": true, "requer_ocr": false, "confianca": {"nivel": "ALTA"}}
  ],
  "secoes": [
    {"secao_id": "SEC-010", "titulo_original": "Parecer técnico fictício", "tipo_normalizado": "CORPO_PRINCIPAL", "pagina_inicio": {"pagina_pdf": 6, "pagina_documento": 1, "pagina_original": "1"}, "pagina_fim": {"pagina_pdf": 6, "pagina_documento": 1, "pagina_original": "1"}, "paginas": [{"pagina_pdf": 6, "pagina_documento": 1, "pagina_original": "1"}], "texto": "Conteúdo técnico fictício de parte.", "proveniencia": {"arquivo": "processo-ficticio.pdf", "sha256": "0000000000000000000000000000000000000000000000000000000000000000", "documento_id": "DOC-PJE-003", "id_pje": "900003", "pagina_pdf": 6, "pagina_documento": 1, "pagina_original": "1", "trecho": "Parecer fictício", "natureza": "CONSTATADO_POR_TECNICO_DA_PARTE", "metodo_extracao": "EXTRACAO_SEMANTICA", "confianca": {"nivel": "MEDIA"}, "status_verificacao": "NAO_VERIFICADO"}},
    {"secao_id": "SEC-011", "titulo_original": "Relatório fotográfico", "tipo_normalizado": "RELATORIO_FOTOGRAFICO", "pagina_inicio": {"pagina_pdf": 7, "pagina_documento": 2, "pagina_original": "2"}, "pagina_fim": {"pagina_pdf": 7, "pagina_documento": 2, "pagina_original": "2"}, "paginas": [{"pagina_pdf": 7, "pagina_documento": 2, "pagina_original": "2"}], "texto": null, "proveniencia": {"arquivo": "processo-ficticio.pdf", "sha256": "0000000000000000000000000000000000000000000000000000000000000000", "documento_id": "DOC-PJE-003", "id_pje": "900003", "pagina_pdf": 7, "pagina_documento": 2, "pagina_original": "2", "trecho": "Relatório fotográfico", "natureza": "DOCUMENTADO", "metodo_extracao": "EXTRACAO_SEMANTICA", "confianca": {"nivel": "ALTA"}, "status_verificacao": "VERIFICADO"}},
    {"secao_id": "SEC-012", "titulo_original": "Orçamento fictício", "tipo_normalizado": "ORCAMENTO", "pagina_inicio": {"pagina_pdf": 8, "pagina_documento": 3, "pagina_original": "3"}, "pagina_fim": {"pagina_pdf": 8, "pagina_documento": 3, "pagina_original": "3"}, "paginas": [{"pagina_pdf": 8, "pagina_documento": 3, "pagina_original": "3"}], "texto": null, "proveniencia": {"arquivo": "processo-ficticio.pdf", "sha256": "0000000000000000000000000000000000000000000000000000000000000000", "documento_id": "DOC-PJE-003", "id_pje": "900003", "pagina_pdf": 8, "pagina_documento": 3, "pagina_original": "3", "trecho": "Orçamento fictício", "natureza": "DOCUMENTADO", "metodo_extracao": "EXTRACAO_SEMANTICA", "confianca": {"nivel": "ALTA"}, "status_verificacao": "VERIFICADO"}}
  ],
  "subdocumentos": [
    {"subdocumento_id": "SUB-010", "documento_pai": "DOC-PJE-003", "titulo": "Relatório fotográfico", "tipo": "RELATORIO_FOTOGRAFICO", "pagina_inicio": {"pagina_pdf": 7, "pagina_documento": 2, "pagina_original": "2"}, "pagina_fim": {"pagina_pdf": 7, "pagina_documento": 2, "pagina_original": "2"}, "paginas": [{"pagina_pdf": 7, "pagina_documento": 2, "pagina_original": "2"}], "possui_texto": true, "possui_imagens": true, "possui_tabelas": false, "proveniencia": {"arquivo": "processo-ficticio.pdf", "sha256": "0000000000000000000000000000000000000000000000000000000000000000", "documento_id": "DOC-PJE-003", "id_pje": "900003", "pagina_pdf": 7, "pagina_documento": 2, "pagina_original": "2", "trecho": "Relatório fotográfico", "natureza": "DOCUMENTADO", "metodo_extracao": "EXTRACAO_SEMANTICA", "confianca": {"nivel": "ALTA"}, "status_verificacao": "VERIFICADO"}},
    {"subdocumento_id": "SUB-011", "documento_pai": "DOC-PJE-003", "titulo": "Orçamento", "tipo": "ORCAMENTO", "pagina_inicio": {"pagina_pdf": 8, "pagina_documento": 3, "pagina_original": "3"}, "pagina_fim": {"pagina_pdf": 8, "pagina_documento": 3, "pagina_original": "3"}, "paginas": [{"pagina_pdf": 8, "pagina_documento": 3, "pagina_original": "3"}], "possui_texto": true, "possui_imagens": false, "possui_tabelas": true, "proveniencia": {"arquivo": "processo-ficticio.pdf", "sha256": "0000000000000000000000000000000000000000000000000000000000000000", "documento_id": "DOC-PJE-003", "id_pje": "900003", "pagina_pdf": 8, "pagina_documento": 3, "pagina_original": "3", "trecho": "Orçamento", "natureza": "DOCUMENTADO", "metodo_extracao": "EXTRACAO_SEMANTICA", "confianca": {"nivel": "ALTA"}, "status_verificacao": "VERIFICADO"}}
  ],
  "blocos_texto": [],
  "tabelas": [{"tabela_id": "TAB-001", "tipo": "TABELA_ORCAMENTO", "titulo": "Orçamento fictício", "texto_bruto": "Item | Descrição | Quantidade", "estrutura_normalizada": [["Item", "Descrição", "Quantidade"], ["1", "Serviço fictício", 1]], "pagina": {"pagina_pdf": 8, "pagina_documento": 3, "pagina_original": "3"}, "proveniencia": {"arquivo": "processo-ficticio.pdf", "sha256": "0000000000000000000000000000000000000000000000000000000000000000", "documento_id": "DOC-PJE-003", "id_pje": "900003", "pagina_pdf": 8, "pagina_documento": 3, "pagina_original": "3", "trecho": "Item fictício", "natureza": "DOCUMENTADO", "metodo_extracao": "TABELA_DIGITAL", "confianca": {"nivel": "ALTA"}, "status_verificacao": "VERIFICADO"}, "confianca": {"nivel": "ALTA"}}],
  "imagens": [],
  "fotografias": [{"fotografia_id": "FOT-001", "numero_original": "1", "rotulo_original": "Foto 1", "legenda": "Registro fictício", "pagina_pdf": 7, "pagina_documento": 2, "pagina_original": "2", "ambiente": "Ambiente fictício", "sistema": null, "descricao": "Fotografia fictícia de teste", "data_hora": null, "coordenadas": null, "documento_pai": "DOC-PJE-003", "proveniencia": {"arquivo": "processo-ficticio.pdf", "sha256": "0000000000000000000000000000000000000000000000000000000000000000", "documento_id": "DOC-PJE-003", "id_pje": "900003", "pagina_pdf": 7, "pagina_documento": 2, "pagina_original": "2", "trecho": "Foto 1", "natureza": "CONSTATADO_POR_TECNICO_DA_PARTE", "metodo_extracao": "TEXTO_DIGITAL", "confianca": {"nivel": "ALTA"}, "status_verificacao": "NAO_VERIFICADO"}, "confianca": {"nivel": "ALTA"}}],
  "eventos": [], "quesitos": [],
  "alegacoes": [{"alegacao_id": "ALG-001", "origem": "Técnico fictício da parte", "texto": "Constatação fictícia atribuída ao técnico da parte.", "ambiente_alegado": "Ambiente fictício", "sistema_alegado": null, "tipo": "CONSTATADO_POR_TECNICO_DA_PARTE", "proveniencia": {"arquivo": "processo-ficticio.pdf", "sha256": "0000000000000000000000000000000000000000000000000000000000000000", "documento_id": "DOC-PJE-003", "id_pje": "900003", "pagina_pdf": 6, "pagina_documento": 1, "pagina_original": "1", "trecho": "Constatação fictícia", "natureza": "CONSTATADO_POR_TECNICO_DA_PARTE", "metodo_extracao": "EXTRACAO_SEMANTICA", "confianca": {"nivel": "MEDIA"}, "status_verificacao": "NAO_VERIFICADO"}, "confianca": {"nivel": "MEDIA"}}],
  "entidades": [], "referencias_normativas": [],
  "fontes": [{"arquivo": "processo-ficticio.pdf", "sha256": "0000000000000000000000000000000000000000000000000000000000000000", "documento_id": "DOC-PJE-003", "id_pje": "900003", "pagina_pdf": 6, "pagina_documento": 1, "pagina_original": "1", "trecho": "Parecer fictício", "natureza": "DOCUMENTADO", "metodo_extracao": "RODAPE_PJE", "confianca": {"nivel": "ALTA"}, "status_verificacao": "VERIFICADO"}],
  "conflitos": [], "alertas": [],
  "status_reconciliacao": {"status": "CONFIRMADO", "id_indice": "900003", "id_rodape": "900003", "pagina_destino_link": 6, "primeira_pagina_detectada": 6, "ultima_pagina_detectada": 8, "evidencias": [], "motivos": [], "confianca": {"nivel": "ALTA"}},
  "status_validacao": "VALIDADO"
}
