{
  "schema_version": "1.0.0",
  "documento_id": "DOC-PJE-001",
  "id_pje": "900001",
  "processo_cnj": "0000001-00.2026.4.00.0001",
  "titulo_original": "Petição inicial fictícia",
  "tipo_original": "Petição inicial",
  "classe_normalizada": "PETICAO_INICIAL",
  "subclasse_normalizada": null,
  "prioridade": "A_ESSENCIAL",
  "ordem_indice": 1,
  "data_hora": "2026-01-01T10:00:00-03:00",
  "paginas": [{"referencia": {"pagina_pdf": 3, "pagina_documento": 1, "pagina_original": null}, "classificacao": "TEXTO_DIGITAL", "possui_texto_util": true, "possui_imagens": false, "possui_tabelas": false, "requer_ocr": false, "confianca": {"nivel": "ALTA"}}],
  "secoes": [],
  "subdocumentos": [],
  "blocos_texto": [],
  "tabelas": [],
  "imagens": [],
  "fotografias": [],
  "eventos": [],
  "quesitos": [],
  "alegacoes": [],
  "entidades": [],
  "referencias_normativas": [],
  "fontes": [{"arquivo": "processo-ficticio.pdf", "sha256": "0000000000000000000000000000000000000000000000000000000000000000", "documento_id": "DOC-PJE-001", "id_pje": "900001", "pagina_pdf": 3, "pagina_documento": 1, "pagina_original": null, "trecho": "Petição fictícia", "natureza": "ALEGADO", "metodo_extracao": "TEXTO_DIGITAL", "confianca": {"nivel": "ALTA", "score": 0.99}, "status_verificacao": "VERIFICADO"}],
  "conflitos": [],
  "alertas": [],
  "status_reconciliacao": {"status": "CONFIRMADO", "id_indice": "900001", "id_rodape": "900001", "pagina_destino_link": 3, "primeira_pagina_detectada": 3, "ultima_pagina_detectada": 3, "evidencias": [], "motivos": [], "confianca": {"nivel": "ALTA"}},
  "status_validacao": "VALIDADO"
}
